{
  "规范版本": "1.0.0",
  "skill_version": "1.3.0",
  "任务元数据": {
    "任务编号": "CASE-MIN-001",
    "调查基准日": "2026-08-28",
    "创建时间": "2026-08-28T09:00:00+08:00",
    "更新时间": "2026-08-28T09:00:00+08:00",
    "原始请求": "调查 Progress Mfg. Inc. 与重量分配式拖车挂接装置相关的核心人员。"
  },
  "输入材料": [],
  "技术主题": {
    "主题名称": "重量分配式拖车挂接装置",
    "主题描述": "用于牵引车与拖车之间载荷分配和防摇摆的挂接装置。",
    "产品或技术关键词": ["weight distribution hitch"],
    "用户原文引用": []
  },
  "目标主体引用": ["ENT-001"],
  "公司主体": [
    {
      "主体编号": "ENT-001",
      "原始名称": ["Progress Mfg. Inc."],
      "规范法律名称": "Progress Mfg. Inc.",
      "注册地": "美国",
      "唯一识别信息": [],
      "名称变体": [],
      "主体身份状态": "待核验",
      "是否目标主体": true,
      "证据引用": [],
      "待复核事项": []
    }
  ],
  "主体关系": [],
  "核心人员": [],
  "人员身份": [],
  "证据记录": [],
  "查询记录": [],
  "冲突与待确认项": [],
  "主体调查结果": [
    {
      "结果编号": "RES-001",
      "主体引用": "ENT-001",
      "调查进度": "调查中",
      "事实核验状态": "待核验",
      "人员身份引用": [],
      "查询记录引用": [],
      "阻塞原因": [],
      "复核建议": []
    }
  ],
  "阶段判断": {
    "整体状态": "调查中",
    "主体总数": 1,
    "已识别人员数": 0,
    "已核验身份数": 0,
    "未解决关键事项": [],
    "需要用户确认": false,
    "用户可执行动作": []
  },
  "用户确认记录": [],
  "渲染元数据": {
    "状态内容哈希": "",
    "渲染器版本": "",
    "最近渲染时间": null
  }
}
